Main_Info,Extra_Info,Description,Properties
"Changan Uni-K iDD,1.5 L,2024 il,11 691 km","ŞəhərBakıMarkaChanganModelUni-K iDDBuraxılış ili2024Ban növüOffroader / SUV, 5 qapıRəngYaş AsfaltMühərrik1.5 L / 282 a.g. / HibridYürüş11 691 kmSürətlər qutusuVariatorÖtürücüTamYeniXeyrYerlərin sayı5VəziyyətiVuruğu yoxdur, rənglənməyibHansı bazar üçün yığılıbRəsmi diler - Davamını oxuBiz sərfəli qiymətlərlə yeni və ikinci əl avtomobillər təklif edirik, həmçinin Çindən sifarişlə avtomobil seçimi və gətirilməsi xidmətini göstəririk. DX Motors sadəcə avtomobil satmır – biz yaşıl gələcəyə aparan yolu inşa edirik. Gələcəyin nəqliyyatını bu gündən birlikdə qururuq.Nömrəni göstər - Yüngül lehimli disklərABSLyukYağış sensoruMərkəzi qapanmaPark radarıKondisionerOturacaqların isidilməsiDəri salonKsenon lampalarArxa görüntü kamerasıYan pərdələrOturacaqların ventilyasiyası - Düzəliş etElanı silElanın nömrəsi: 9384381","Biz sərfəli qiymətlərlə yeni və ikinci əl avtomobillər təklif edirik, həmçinin Çindən sifarişlə avtomobil seçimi və gətirilməsi xidmətini göstəririk. DX Motors sadəcə avtomobil satmır – biz yaşıl gələcəyə aparan yolu inşa edirik. Gələcəyin nəqliyyatını bu gündən birlikdə qururuq.Nömrəni göstər",Yüngül lehimli disklərABSLyukYağış sensoruMərkəzi qapanmaPark radarıKondisionerOturacaqların isidilməsiDəri salonKsenon lampalarArxa görüntü kamerasıYan pərdələrOturacaqların ventilyasiyası,36 800 AZN
"Ford Transit,2.4 L,2007 il,199 000 km","ŞəhərBakıMarkaFordModelTransitBuraxılış ili2007Ban növüYük maşınıRəngAğMühərrik2.4 L / 140 a.g. / DizelYürüş199 000 kmSürətlər qutusuMexanikiÖtürücüArxaYeniXeyrYerlərin sayı3VəziyyətiVuruğu yoxdur, rənglənməyib - Davamını oxuYeni qelib. Uzunluqu 4.20. Eni 2.10.Tam full. TREND. Furqon-Liftli.Satishda bashka modellerde var.Unvan: Nefciler, Bakcell arena. - Yüngül lehimli disklərABSMərkəzi qapanmaKondisioner - Düzəliş etElanı silElanın nömrəsi: 9134943","Yeni qelib. Uzunluqu 4.20. Eni 2.10.Tam full. TREND. Furqon-Liftli.Satishda bashka modellerde var.Unvan: Nefciler, Bakcell arena.",Yüngül lehimli disklərABSMərkəzi qapanmaKondisioner,35 500 AZN
"BMW 535,3.0 L,2010 il,245 000 km","ŞəhərBakıMarkaBMWModel535Buraxılış ili2010Ban növüSedanRəngAğMühərrik3.0 L / 306 a.g. / BenzinYürüş245 000 kmSürətlər qutusuAvtomatÖtürücüArxaYeniXeyrYerlərin sayı5VəziyyətiVuruğu yoxdur, rənglənməyibHansı bazar üçün yığılıbAvropa - Davamını oxuMaşın ideal vəziyyətdədir. Polnu full variant. Headup display. Prisos qapılar və baqaj. 4 qapıda keyless go. Kamera sitemi 360 ,kör nöqtə və arxa görüntü. Sport komfort oturacaqlar , isitmə soyutma. M5 səs sistemi. Adaptiv led faralar. Rəsmi servisdə yeni texniki baxışdan keçib – yağı, filtrləri və digər xərcli hissələri yenilənib. Hal-hazırda heç bir xərc tələb etmir. Bütün detallar orijinaldır, Tayvan istehsalı heç bir hissə yoxdur. Baxımlı maşındır. Orijinal detallarla 'M' yığılıb. Sənəddə 'M' yığılması qeyd olunub. Maşın gündəlik istifadə olunur. Tez satılması zərurəti yaranması səbəbindən qiymət endirilib. - Yüngül lehimli disklərABSLyukYağış sensoruMərkəzi qapanmaPark radarıKondisionerOturacaqların isidilməsiDəri salonKsenon lampalarArxa görüntü kamerasıYan pərdələrOturacaqların ventilyasiyası - Düzəliş etElanı silElanın nömrəsi: 9267735","Maşın ideal vəziyyətdədir. Polnu full variant. Headup display. Prisos qapılar və baqaj. 4 qapıda keyless go. Kamera sitemi 360 ,kör nöqtə və arxa görüntü. Sport komfort oturacaqlar , isitmə soyutma. M5 səs sistemi. Adaptiv led faralar. Rəsmi servisdə yeni texniki baxışdan keçib – yağı, filtrləri və digər xərcli hissələri yenilənib. Hal-hazırda heç bir xərc tələb etmir. Bütün detallar orijinaldır, Tayvan istehsalı heç bir hissə yoxdur. Baxımlı maşındır. Orijinal detallarla 'M' yığılıb. Sənəddə 'M' yığılması qeyd olunub. Maşın gündəlik istifadə olunur. Tez satılması zərurəti yaranması səbəbindən qiymət endirilib.",Yüngül lehimli disklərABSLyukYağış sensoruMərkəzi qapanmaPark radarıKondisionerOturacaqların isidilməsiDəri salonKsenon lampalarArxa görüntü kamerasıYan pərdələrOturacaqların ventilyasiyası,32 500 AZN
"Porsche Panamera 4S,3.0 L,2014 il,129 000 km","ŞəhərBakıMarkaPorscheModelPanamera 4SBuraxılış ili2014Ban növüLiftbekRəngQaraMühərrik3.0 L / 420 a.g. / BenzinYürüş129 000 kmSürətlər qutusuRobotÖtürücüTamYeniXeyrYerlərin sayı4Sahiblər2VəziyyətiVuruğu yoxdur, rənglənməyibHansı bazar üçün yığılıbRəsmi diler - Davamını oxu— Rəsmi servis— Avtomobil rəsmi Porcshe servisdə zəmanətdədir (motor, sürət qutusu, elektronika, xodovoy) 👌2 il zəmanətlə30% ilkin ödənişlə lizinqə salına bilər. - Yüngül lehimli disklərABSLyukYağış sensoruMərkəzi qapanmaPark radarıKondisionerOturacaqların isidilməsiDəri salonKsenon lampalarArxa görüntü kamerasıYan pərdələrOturacaqların ventilyasiyası - Düzəliş etElanı silElanın nömrəsi: 9165014","— Rəsmi servis— Avtomobil rəsmi Porcshe servisdə zəmanətdədir (motor, sürət qutusu, elektronika, xodovoy) 👌2 il zəmanətlə30% ilkin ödənişlə lizinqə salına bilər.",Yüngül lehimli disklərABSLyukYağış sensoruMərkəzi qapanmaPark radarıKondisionerOturacaqların isidilməsiDəri salonKsenon lampalarArxa görüntü kamerasıYan pərdələrOturacaqların ventilyasiyası,32 000 USD
"Renault Megane,1.5 L,2008 il,324 733 km","ŞəhərSumqayıtMarkaRenaultModelMeganeBuraxılış ili2008Ban növüUniversal, 5 qapıRəngGümüşüMühərrik1.5 L / 85 a.g. / DizelYürüş324 733 kmSürətlər qutusuMexanikiÖtürücüÖnYeniXeyrVəziyyətiVuruğu yoxdur, rənglənməyib - Davamını oxuMaşın saz vezyetedi şexsi maşnmdı özm getrmişem gelenende mendedi mator karopka xadavoy ela vezyetedi bütün funksyalar işlekdi sms matordu salon ter temiz çiçek kimi kasmetkası ela tekerler yaxşı bütün senedlerde qaydasındadı AllAh alana xeyir versin - Yüngül lehimli disklərABSMərkəzi qapanmaPark radarıKondisionerKsenon lampalarYan pərdələr - Düzəliş etElanı silElanın nömrəsi: 9404590",Maşın saz vezyetedi şexsi maşnmdı özm getrmişem gelenende mendedi mator karopka xadavoy ela vezyetedi bütün funksyalar işlekdi sms matordu salon ter temiz çiçek kimi kasmetkası ela tekerler yaxşı bütün senedlerde qaydasındadı AllAh alana xeyir versin,Yüngül lehimli disklərABSMərkəzi qapanmaPark radarıKondisionerKsenon lampalarYan pərdələr,7 800 AZN
"Haojue DL160,150 sm3,2024 il,yeni","ŞəhərBakıMarkaHaojueModelDL160Buraxılış ili2024Ban növüMotosikletRəngQırmızıMühərrik150 sm3/ 15 a.g. / BenzinYürüş0 kmSürətlər qutusuMexanikiÖtürücüArxaYeniBəliYerlərin sayı2VəziyyətiVuruğu yoxdur, rənglənməyibHansı bazar üçün yığılıbAvropa - Davamını oxuKredit şərtləri:İlkin ödəniş - 50%Kredit müddəti - 1 ilə qədər 0%━━━━━━━━━━━━━━━━━━━━━━━━━━━━━━━━• Ölçülər (Uzunluq × En × Hündürlük): 2025 mm × 775 mm × 1195 mm• Təkər bazası: 1345 mm• Boş kütlə (Curb Mass): 148 kq• Yerdən hündürlük (Ground Clearance): 160 mm• Oturacaq hündürlüyü: 795 mm• Yanacaq çəni tutumu: 13 litr• Əyləc tipi: Öndə: Disk, Arxada: Disk━━━━━━━━━━━━━━━━━━━━━━━━━━━━━━━━Təkər ölçüləri:• Ön: 100/80-17• Arxa: 130/70-17━━━━━━━━━━━━━━━━━━━━━━━━━━━━━━━━Mühərrik Məlumatları:• Mühərrik tipi: Tək silindrli, hava ilə soyudulan, 4 taktlı• Həcm (Mühərrik tutumu): 162 sm³• Silindr diametri və gedişi (Bore × Stroke): 60 mm × 57.4 mm• Maksimal güc: 11 kVt (8000 dövr/dəq)• Maksimal fırlanma anı: 14 N•m (6500 dövr/dəq)• Yanacaq təchizatı sistemi: Elektron yanacaq inyeksiyası (FI)• Sürət qutusu: 5 pilləli, geri dönüşlü ötürmə sistemi• Starter: Elektrikli; Elektrik və ayaqla start - Yüngül lehimli disklərABSMərkəzi qapanmaDəri salonKsenon lampalar - Düzəliş etElanı silElanın nömrəsi: 9420678","Kredit şərtləri:İlkin ödəniş - 50%Kredit müddəti - 1 ilə qədər 0%━━━━━━━━━━━━━━━━━━━━━━━━━━━━━━━━• Ölçülər (Uzunluq × En × Hündürlük): 2025 mm × 775 mm × 1195 mm• Təkər bazası: 1345 mm• Boş kütlə (Curb Mass): 148 kq• Yerdən hündürlük (Ground Clearance): 160 mm• Oturacaq hündürlüyü: 795 mm• Yanacaq çəni tutumu: 13 litr• Əyləc tipi: Öndə: Disk, Arxada: Disk━━━━━━━━━━━━━━━━━━━━━━━━━━━━━━━━Təkər ölçüləri:• Ön: 100/80-17• Arxa: 130/70-17━━━━━━━━━━━━━━━━━━━━━━━━━━━━━━━━Mühərrik Məlumatları:• Mühərrik tipi: Tək silindrli, hava ilə soyudulan, 4 taktlı• Həcm (Mühərrik tutumu): 162 sm³• Silindr diametri və gedişi (Bore × Stroke): 60 mm × 57.4 mm• Maksimal güc: 11 kVt (8000 dövr/dəq)• Maksimal fırlanma anı: 14 N•m (6500 dövr/dəq)• Yanacaq təchizatı sistemi: Elektron yanacaq inyeksiyası (FI)• Sürət qutusu: 5 pilləli, geri dönüşlü ötürmə sistemi• Starter: Elektrikli; Elektrik və ayaqla start",Yüngül lehimli disklərABSMərkəzi qapanmaDəri salonKsenon lampalar,6 600 AZN
"Nissan Pathfinder,4.0 L,2006 il,195 000 km","ŞəhərGəncəMarkaNissanModelPathfinderBuraxılış ili2006Ban növüOffroader / SUV, 5 qapıRəngGümüşüMühərrik4.0 L / 269 a.g. / BenzinYürüş195 000 kmSürətlər qutusuAvtomatÖtürücüTamYeniXeyrYerlərin sayı7Sahiblər2VəziyyətiVuruğu yoxdur, rənglənməyibHansı bazar üçün yığılıbAvropa - Davamını oxuMaşın ideal vəziyyətdədi əsil Ailə maşınıdı 7 yerlikdi. Hər bir funksiyası işləkdi, vaxtı vaxtında qulluq olunub. Gözel Maşındı.Satmağıma sebeb sadece ilini Tezelemekdi, Başqa sebeb axtarmayın. - Yüngül lehimli disklərABSYağış sensoruMərkəzi qapanmaPark radarıKondisionerKsenon lampalarArxa görüntü kamerası - Düzəliş etElanı silElanın nömrəsi: 9443649","Maşın ideal vəziyyətdədi əsil Ailə maşınıdı 7 yerlikdi. Hər bir funksiyası işləkdi, vaxtı vaxtında qulluq olunub. Gözel Maşındı.Satmağıma sebeb sadece ilini Tezelemekdi, Başqa sebeb axtarmayın.",Yüngül lehimli disklərABSYağış sensoruMərkəzi qapanmaPark radarıKondisionerKsenon lampalarArxa görüntü kamerası,15 500 AZN
"Lexus RX 350,3.5 L,2017 il,37 000 km","ŞəhərBakıMarkaLexusModelRX 350Buraxılış ili2017Ban növüOffroader / SUV, 5 qapıRəngBozMühərrik3.5 L / 301 a.g. / BenzinYürüş37 000 kmSürətlər qutusuAvtomatÖtürücüTamYeniXeyrYerlərin sayı5Sahiblər1VəziyyətiVuruğu yoxdur, rənglənməyibHansı bazar üçün yığılıbAvropa - Davamını oxuLexus RX 350 F Sport 2017F Sport premium səviyyəsində prestijli, etibarlı və güclü krossover.Mühərrik: 3,5 V6, 302 at gücüSürücü: tam ötürücü (AWD), 8 pilləli avtomatik.Sərfiyyat: ~10l/100 kmAvadanlıqlar: dəri, F-Sport oturacaqları, Mark Levinson, HUD, 360° kameralar, adaptiv kruiz, açarsız giriş və s.Tam olarag FullHer seyi var0-100 6.9sCox dozumlu mator15 eded dinamiki varZolag tutma2018 ilde resmi Lexus salonunnan alinibVe yalniz orda gullug olunubUdar ve kraskadan sohbet gede bilmez cox ideal veziyetderReal aliciya cuzi endirim olacag - Yüngül lehimli disklərABSLyukYağış sensoruMərkəzi qapanmaPark radarıKondisionerOturacaqların isidilməsiDəri salonKsenon lampalarArxa görüntü kamerasıYan pərdələrOturacaqların ventilyasiyası - Düzəliş etElanı silElanın nömrəsi: 9457009","Lexus RX 350 F Sport 2017F Sport premium səviyyəsində prestijli, etibarlı və güclü krossover.Mühərrik: 3,5 V6, 302 at gücüSürücü: tam ötürücü (AWD), 8 pilləli avtomatik.Sərfiyyat: ~10l/100 kmAvadanlıqlar: dəri, F-Sport oturacaqları, Mark Levinson, HUD, 360° kameralar, adaptiv kruiz, açarsız giriş və s.Tam olarag FullHer seyi var0-100 6.9sCox dozumlu mator15 eded dinamiki varZolag tutma2018 ilde resmi Lexus salonunnan alinibVe yalniz orda gullug olunubUdar ve kraskadan sohbet gede bilmez cox ideal veziyetderReal aliciya cuzi endirim olacag",Yüngül lehimli disklərABSLyukYağış sensoruMərkəzi qapanmaPark radarıKondisionerOturacaqların isidilməsiDəri salonKsenon lampalarArxa görüntü kamerasıYan pərdələrOturacaqların ventilyasiyası,53 900 USD
"Nissan Pathfinder,3.5 L,2012 il,281 915 km","ŞəhərSumqayıtMarkaNissanModelPathfinderBuraxılış ili2012Ban növüOffroader / SUV, 5 qapıRəngQaraMühərrik3.5 L / 249 a.g. / BenzinYürüş281 915 kmSürətlər qutusuVariatorÖtürücüTamYeniXeyrYerlərin sayı7VəziyyətiVuruğu yoxdur, rənglənməyibHansı bazar üçün yığılıbRəsmi diler - Davamını oxuTexniki ve elektron sistemi tam qaydasindadi.Istenilen servisde yoxlatdira bilersiniz.Kreditle mumkundur.Ilkin odenis - 9700Muddet 36aya qeder olur.Senedlesme 2saat erzinde tehvil verilir Avtosalon terefden.Unvan Bakı Sumqayıt şosesi masin bazarina çatmamış BRO Cars - Yüngül lehimli disklərABSLyukYağış sensoruMərkəzi qapanmaPark radarıKondisionerOturacaqların isidilməsiDəri salonKsenon lampalarArxa görüntü kamerasıYan pərdələrOturacaqların ventilyasiyası - Düzəliş etElanı silElanın nömrəsi: 9480119",Texniki ve elektron sistemi tam qaydasindadi.Istenilen servisde yoxlatdira bilersiniz.Kreditle mumkundur.Ilkin odenis - 9700Muddet 36aya qeder olur.Senedlesme 2saat erzinde tehvil verilir Avtosalon terefden.Unvan Bakı Sumqayıt şosesi masin bazarina çatmamış BRO Cars,Yüngül lehimli disklərABSLyukYağış sensoruMərkəzi qapanmaPark radarıKondisionerOturacaqların isidilməsiDəri salonKsenon lampalarArxa görüntü kamerasıYan pərdələrOturacaqların ventilyasiyası,25 900 AZN
"BMW iX1,2025 il,yeni","ŞəhərBakıMarkaBMWModeliX1Buraxılış ili2025Ban növüOffroader / SUV, 5 qapıRəngQaraMühərrik204 a.g. / ElektroYürüş0 kmSürətlər qutusuReduktorÖtürücüTamYeniBəliYerlərin sayı5VəziyyətiVuruğu yoxdur, rənglənməyib - Davamını oxuGömrük rüsumu qiymətə daxildirBMW iX1 eDrive25L M Sport- 4616*1845*1641 uzunuluğu*eni*hündürlüyü- 0-100km/s sürətlənmə 8.6s ərzində- Tam şarjla 510KM məsafə qət edir- Maksimum sürət həddi 170 km/s- 64.7kWs həcmində batareya- 204 at gücü- Zolaqdan çıxma xəbərdarlığı- Aktiv braking(safety) sistemi- 18"" Disklər- Head-Up display(opsional)- Arxa görüntü kamerası- Sport(M) oturacaqlar- Sürücü oturacağının yaddaş funksiyası- İnduktiv baqaj qapısının açılıb/bağlanması- Touch LCD mərkəzi idarəetmə ekranı- Harman Kardon səs sistemi(opsional)- Adaptiv Kruiz Kontrol- Adaptiv LED fənərlər- Panoramik Dam- Ambient işıqlandırma- Simsiz Şarj- Apple CarPlay-----------------------------------------------------------Zəhmət olmasa, iş vaxtlarında əlaqə saxlayın:İş saatları: 10:00 - 19:00 - Yüngül lehimli disklərABSLyukYağış sensoruMərkəzi qapanmaPark radarıKondisionerOturacaqların isidilməsiDəri salonKsenon lampalarArxa görüntü kamerasıOturacaqların ventilyasiyası - Düzəliş etElanı silElanın nömrəsi: 9381102","Gömrük rüsumu qiymətə daxildirBMW iX1 eDrive25L M Sport- 4616*1845*1641 uzunuluğu*eni*hündürlüyü- 0-100km/s sürətlənmə 8.6s ərzində- Tam şarjla 510KM məsafə qət edir- Maksimum sürət həddi 170 km/s- 64.7kWs həcmində batareya- 204 at gücü- Zolaqdan çıxma xəbərdarlığı- Aktiv braking(safety) sistemi- 18"" Disklər- Head-Up display(opsional)- Arxa görüntü kamerası- Sport(M) oturacaqlar- Sürücü oturacağının yaddaş funksiyası- İnduktiv baqaj qapısının açılıb/bağlanması- Touch LCD mərkəzi idarəetmə ekranı- Harman Kardon səs sistemi(opsional)- Adaptiv Kruiz Kontrol- Adaptiv LED fənərlər- Panoramik Dam- Ambient işıqlandırma- Simsiz Şarj- Apple CarPlay-----------------------------------------------------------Zəhmət olmasa, iş vaxtlarında əlaqə saxlayın:İş saatları: 10:00 - 19:00",Yüngül lehimli disklərABSLyukYağış sensoruMərkəzi qapanmaPark radarıKondisionerOturacaqların isidilməsiDəri salonKsenon lampalarArxa görüntü kamerasıOturacaqların ventilyasiyası,25 500 USD
"Infiniti QX55,2.0 L,2022 il,17 000 km","ŞəhərTovuzMarkaInfinitiModelQX55Buraxılış ili2022Ban növüSUV KupeRəngBozMühərrik2.0 L / 268 a.g. / BenzinYürüş17 000 kmSürətlər qutusuVariatorÖtürücüTamYeniXeyrYerlərin sayı5VəziyyətiVuruğu yoxdur, rənglənibHansı bazar üçün yığılıbRəsmi diler - Yüngül lehimli disklərABSLyukYağış sensoruMərkəzi qapanmaPark radarıKondisionerOturacaqların isidilməsiDəri salonKsenon lampalarArxa görüntü kamerasıOturacaqların ventilyasiyası - Düzəliş etElanı silElanın nömrəsi: 9467909",,Yüngül lehimli disklərABSLyukYağış sensoruMərkəzi qapanmaPark radarıKondisionerOturacaqların isidilməsiDəri salonKsenon lampalarArxa görüntü kamerasıOturacaqların ventilyasiyası,36 400 USD
"Hyundai Sonata,2.0 L,2014 il,110 000 km","ŞəhərBakıMarkaHyundaiModelSonataBuraxılış ili2014Ban növüSedanRəngAğMühərrik2.0 L / 274 a.g. / BenzinYürüş110 000 kmSürətlər qutusuAvtomatÖtürücüÖnYeniXeyrYerlərin sayı5VəziyyətiVuruğu yoxdur, rənglənməyibHansı bazar üçün yığılıbAmerika - Davamını oxuSalam maşnin hec bir prablemi yoxdu - Yüngül lehimli disklərABSLyukYağış sensoruMərkəzi qapanmaPark radarıKondisionerOturacaqların isidilməsiDəri salonKsenon lampalarArxa görüntü kamerasıYan pərdələrOturacaqların ventilyasiyası - Düzəliş etElanı silElanın nömrəsi: 9479732",Salam maşnin hec bir prablemi yoxdu,Yüngül lehimli disklərABSLyukYağış sensoruMərkəzi qapanmaPark radarıKondisionerOturacaqların isidilməsiDəri salonKsenon lampalarArxa görüntü kamerasıYan pərdələrOturacaqların ventilyasiyası,23 500 AZN
"Ford Transit,2.2 L,2014 il,111 000 km","ŞəhərBakıMarkaFordModelTransitBuraxılış ili2014Ban növüFurqonRəngAğMühərrik2.2 L / 155 a.g. / DizelYürüş111 000 kmSürətlər qutusuMexanikiÖtürücüArxaYeniXeyrYerlərin sayı3VəziyyətiVuruğu yoxdur, rənglənməyib - Davamını oxuYeni qelib. TREND. Uzunluqu 4.20Bezkraska. Orijinal probeq. Yuklu kutle 4.7t.Satishda bashka midellerde var.Satish EDV daxil mumkundur.Unvan: Nefciler, Bakcell arena. - Yüngül lehimli disklərABSYağış sensoruMərkəzi qapanmaPark radarıKondisionerArxa görüntü kamerası - Düzəliş etElanı silElanın nömrəsi: 9423272","Yeni qelib. TREND. Uzunluqu 4.20Bezkraska. Orijinal probeq. Yuklu kutle 4.7t.Satishda bashka midellerde var.Satish EDV daxil mumkundur.Unvan: Nefciler, Bakcell arena.",Yüngül lehimli disklərABSYağış sensoruMərkəzi qapanmaPark radarıKondisionerArxa görüntü kamerası,44 400 AZN
"Ford Fusion (North America),1.5 L,2021 il,96 000 km","ŞəhərBakıMarkaFordModelFusion (North America)Buraxılış ili2021Ban növüSedanRəngQaraMühərrik1.5 L / 184 a.g. / BenzinYürüş96 000 kmSürətlər qutusuAvtomatÖtürücüÖnYeniXeyrYerlərin sayı5Sahiblər1VəziyyətiVuruğu yoxdur, rənglənməyibHansı bazar üçün yığılıbAmerika - Davamını oxuMaşın ölkəyə yeni gelibRastamoşka olunubideal vəziyətədiBir manat bele xerci yoxduNömrə AlınıbFORD FUSİON100%-Orginal probeqSuper vəziyyətdədirİstənilən yerdə və AvtoServizlərdə yoxlatdıra bilərsiniz.Masının rengi tund goy........................................................Böyük plazma ManitorArxa Görüntülü KamerasıDistronika mane görəndə tormuzlamaXət tutanArxa RadarStart StopAçarsız Daxil olmaAvto StopAvto Ekanomİşıqforda mühərikin sönübXoda düşməsiİki Zonalı Kilimıt KondisanerMulti rulRulda KəpənəklərAvto pilotKor NöqtəUsb bulutuz SistemiNaviqator yaddaş KartıPolirofka olunupKosmetkaya ehtiyac yoxduOtur sur masindiBez kraska......................................................Xaiş Edirəm SudaQalmış və Udar Görmüş vəAerabakları AtmışMaşınlarla müqaisə etməyi - Yüngül lehimli disklərABSMərkəzi qapanmaPark radarıKondisionerKsenon lampalarArxa görüntü kamerasıYan pərdələr - Düzəliş etElanı silElanın nömrəsi: 9472735",Maşın ölkəyə yeni gelibRastamoşka olunubideal vəziyətədiBir manat bele xerci yoxduNömrə AlınıbFORD FUSİON100%-Orginal probeqSuper vəziyyətdədirİstənilən yerdə və AvtoServizlərdə yoxlatdıra bilərsiniz.Masının rengi tund goy........................................................Böyük plazma ManitorArxa Görüntülü KamerasıDistronika mane görəndə tormuzlamaXət tutanArxa RadarStart StopAçarsız Daxil olmaAvto StopAvto Ekanomİşıqforda mühərikin sönübXoda düşməsiİki Zonalı Kilimıt KondisanerMulti rulRulda KəpənəklərAvto pilotKor NöqtəUsb bulutuz SistemiNaviqator yaddaş KartıPolirofka olunupKosmetkaya ehtiyac yoxduOtur sur masindiBez kraska......................................................Xaiş Edirəm SudaQalmış və Udar Görmüş vəAerabakları AtmışMaşınlarla müqaisə etməyi,Yüngül lehimli disklərABSMərkəzi qapanmaPark radarıKondisionerKsenon lampalarArxa görüntü kamerasıYan pərdələr,22 900 AZN
"Volkswagen Transporter,2.0 L,2018 il,127 000 km","ŞəhərBakıMarkaVolkswagenModelTransporterBuraxılış ili2018Ban növüMinivanRəngQaraMühərrik2.0 L / 150 a.g. / DizelYürüş127 000 kmSürətlər qutusuAvtomatÖtürücüArxaYeniXeyrVəziyyətiVuruğu yoxdur, rənglənməyibHansı bazar üçün yığılıbAvropa - Davamını oxuVurulmayıb !Əlavə xərc tələb olunmunr !===========================TEST DRİVE MÜMKÜNDÜR !DAHA ƏTRAFLI MƏLUMAT AŞAĞIDAKİ GÖSTƏRİLƏN ÜNVANDA ALA BİLƏRSİNİZ!ÜNVAN - BAKI AVTOMOBİL SATIŞ MƏRKƏZİ (BADAMDAR MAŞIN BAZARI)AVTOSALON - BADAMDAR RƏSMİ DİLER STUDIO360==========================QEYD 1:- Müraciyyət etdiyiniz zaman avotmobil stokda olmadığı halda sifarişlə qətirilə bilər ! Daha ətraflı məlumat almaq üçün bizimlə əlaqə saxlayın !QEYD 2:Avtomobiliniz üçün peşəkar foto çəkiliş etmək təklif edirik !Elanınız diqər elanlardan fərqlənsin, baxışların və satış şanslarınız artsın !AVTOSALON ""BADAMDAR RƏSMİ DİLER STUDİO360"" - avtomobilinizin satışında köməkçinizdir!Avtomobilinizi bizim salona satış məqsədi ilə yerləşdirə bilərsiniz ! - Düzəliş etElanı silElanın nömrəsi: 7744055","Vurulmayıb !Əlavə xərc tələb olunmunr !===========================TEST DRİVE MÜMKÜNDÜR !DAHA ƏTRAFLI MƏLUMAT AŞAĞIDAKİ GÖSTƏRİLƏN ÜNVANDA ALA BİLƏRSİNİZ!ÜNVAN - BAKI AVTOMOBİL SATIŞ MƏRKƏZİ (BADAMDAR MAŞIN BAZARI)AVTOSALON - BADAMDAR RƏSMİ DİLER STUDIO360==========================QEYD 1:- Müraciyyət etdiyiniz zaman avotmobil stokda olmadığı halda sifarişlə qətirilə bilər ! Daha ətraflı məlumat almaq üçün bizimlə əlaqə saxlayın !QEYD 2:Avtomobiliniz üçün peşəkar foto çəkiliş etmək təklif edirik !Elanınız diqər elanlardan fərqlənsin, baxışların və satış şanslarınız artsın !AVTOSALON ""BADAMDAR RƏSMİ DİLER STUDİO360"" - avtomobilinizin satışında köməkçinizdir!Avtomobilinizi bizim salona satış məqsədi ilə yerləşdirə bilərsiniz !",,25 900 USD
"Kia K5,2.0 L,2014 il,180 000 km","ŞəhərBakıMarkaKiaModelK5Buraxılış ili2014Ban növüSedanRəngAğMühərrik2.0 L / 165 a.g. / BenzinYürüş180 000 kmSürətlər qutusuAvtomatÖtürücüÖnYeniXeyrYerlərin sayı5VəziyyətiVuruğu yoxdur, rənglənməyibHansı bazar üçün yığılıbKoreya - Davamını oxuSalam. Maşın yaxşı vəziyyətdədir, hec bir prablemi yoxdu, sənədləri qaydasındadır, öz adimadi. Polnu full.2.0 sade mator matorda karobkada prablem yoxdu. Karobka, mator yağı yeni dəyişib. Təkərlər teze. Nömrəsiz satılır. - Yüngül lehimli disklərABSLyukYağış sensoruMərkəzi qapanmaPark radarıKondisionerOturacaqların isidilməsiDəri salonKsenon lampalarArxa görüntü kamerasıYan pərdələrOturacaqların ventilyasiyası - Düzəliş etElanı silElanın nömrəsi: 9439123","Salam. Maşın yaxşı vəziyyətdədir, hec bir prablemi yoxdu, sənədləri qaydasındadır, öz adimadi. Polnu full.2.0 sade mator matorda karobkada prablem yoxdu. Karobka, mator yağı yeni dəyişib. Təkərlər teze. Nömrəsiz satılır.",Yüngül lehimli disklərABSLyukYağış sensoruMərkəzi qapanmaPark radarıKondisionerOturacaqların isidilməsiDəri salonKsenon lampalarArxa görüntü kamerasıYan pərdələrOturacaqların ventilyasiyası,26 000 AZN
